{
  "id": "app-creator-ba-agent",
  "name": "App Creator \u2014 Business Analyst",
  "locality": "CLOUD",
  "enabled": true,
  "providerPreferences": [
    {
      "provider": "openai",
      "model": "gpt-4o"
    },
    {
      "provider": "claude",
      "model": "claude-3-5-sonnet-latest"
    },
    {
      "provider": "ollama",
      "model": "llama3.2"
    }
  ],
  "supportedCommands": [
    "USER_PROMPT",
    "SET_CONTEXT",
    "COMPLETE"
  ],
  "version": "1.0.0"
}
