{
  "id": "execution-estimator",
  "name": "Execution Estimator",
  "locality": "CLOUD",
  "enabled": true,
  "version": "1.0.0",
  "providerPreferences": [
    { "provider": "openai", "model": "gpt-4o-mini" },
    { "provider": "claude", "model": "claude-3-5-haiku-20241022" },
    { "provider": "ollama", "model": "llama3.1:8b" }
  ],
  "supportedCommands": ["SET_CONTEXT", "COMPLETE"],
  "modelTier": "LITE"
}
