{
  "id": "recruitment-cv-loop-coordinator-agent",
  "name": "Recruitment CV Loop Coordinator",
  "locality": "CLOUD",
  "enabled": true,
  "providerPreferences": [
    {
      "provider": "openai",
      "model": "gpt-4o-mini"
    },
    {
      "provider": "claude",
      "model": "claude-3-5-haiku-20241022"
    },
    {
      "provider": "ollama",
      "model": "llama3.2"
    }
  ],
  "supportedCommands": [
    "CONTINUE",
    "COMPLETE"
  ],
  "version": "1.0.0"
}
