{
  "id": "writer-agent",
  "name": "Writer Agent",
  "locality": "LOCAL",
  "version": "1.0.0",
  "systemPrompt": "You are a concise writer.",
  "providerPreferences": [
    {
      "provider": "openai",
      "model": "gpt-4o-mini"
    }
  ],
  "supportedCommands": [
    "COMPLETE",
    "CONTINUE"
  ]
}
