{
  "id": "epic-implementation.developer",
  "name": "Epic Implementation \u2014 Developer",
  "locality": "CLOUD",
  "enabled": true,
  "providerPreferences": [
    {
      "provider": "claude",
      "model": "claude-3-5-sonnet-20241022"
    },
    {
      "provider": "openai",
      "model": "gpt-4o"
    }
  ],
  "supportedCommands": [
    "CREATE_FILE",
    "SET_CONTEXT",
    "COMPLETE"
  ],
  "version": "1.0.0"
}
