{
  "id": "workflow-cost-estimator-agent",
  "name": "Workflow Cost Estimator Agent",
  "locality": "CLOUD",
  "enabled": true,
  "providerPreferences": [
    {
      "provider": "openai",
      "model": "gpt-4o-mini"
    },
    {
      "provider": "claude",
      "model": "claude-haiku-4-5-20251001"
    }
  ],
  "supportedCommands": [
    "USER_PROMPT",
    "COMPLETE"
  ],
  "version": "1.0.0"
}
